{
  "schema": "knowledge-hub.paper.visual-retrieval-hint-candidate-store-expansion-gpt-recommendation-output-validation.v1",
  "status": "ready",
  "generatedAt": "2026-05-27T02:34:21Z",
  "decision": "ready_for_project_side_human_decision_synthesis",
  "nextRecommendedTranche": "visual_annotation_expansion_pack_design_003",
  "sourceRecommendationOutput": {
    "schema": "knowledge-hub.paper.visual-retrieval-hint-candidate-store-expansion-gpt-decision-recommendation-output.v1",
    "reportRef": "eval/knowledgeos/reports/visual_retrieval_hint_candidate_store_expansion_gpt_recommendation_output_001.manual.json",
    "rows": 24
  },
  "sourceGptReviewPack": {
    "schema": "knowledge-hub.paper.visual-retrieval-hint-candidate-store-expansion-gpt-decision-review-pack.v1",
    "status": "ready",
    "reportRef": "eval/knowledgeos/reports/visual_retrieval_hint_candidate_store_expansion_gpt_decision_review_pack.v1.json",
    "packRows": 24
  },
  "scope": {
    "writes": "report_only",
    "apiCalls": false,
    "modelCalls": false,
    "webModelCalls": false,
    "manualOperatorWebModelRunCompletedExternally": true,
    "manualGptRecommendationRows": 24,
    "finalHumanDecisionRows": 0,
    "candidateStoreWriteRows": 0,
    "vectorIndexing": false,
    "indexEligibleRows": 0,
    "strictEvidencePromotionRows": 0,
    "runtimeAnswerVisibleExposureRows": 0,
    "databaseMutationRows": 0,
    "indexMutationRows": 0,
    "reindexOrReembedRows": 0,
    "vaultScanRows": 0,
    "externalDownloadRows": 0,
    "answerabilityGateBypassRows": 0,
    "cropWriteRows": 0,
    "pageImageWriteRows": 0,
    "wholeImageWriteRows": 0,
    "wholeImageGptRows": 0,
    "candidateStoreMutationRows": 0,
    "canonicalParsedArtifactWriteRows": 0
  },
  "policy": {
    "allowedUse": "recommendation_only",
    "recommendationsAreFinalHumanDecisions": false,
    "recommendationsCanAuthorizeApply": false,
    "recommendationsCanWriteCandidateStore": false,
    "projectSideGateOwnsFinalDecision": true,
    "gptRole": "advisory_image_layout_recommendation_only",
    "allowedSuggestedDecisions": [
      "approve_store_candidate_only",
      "hold_pending_more_context",
      "reject_visual_hint_candidate",
      "request_recrop_or_reannotation"
    ],
    "nextPracticalWork": "visual_annotation_expansion_pack_design_003"
  },
  "counts": {
    "sourcePackRows": 24,
    "outputRows": 24,
    "matchedRows": 24,
    "missingRows": 0,
    "extraRows": 0,
    "duplicateRows": 0,
    "approvedRecommendationRows": 18,
    "holdRecommendationRows": 5,
    "rejectRecommendationRows": 0,
    "recropRecommendationRows": 1,
    "policyViolationRows": 0,
    "placeholderRows": 0,
    "finalHumanDecisionRows": 0,
    "applyAllowedRows": 0,
    "candidateStoreWriteRows": 0,
    "strictEvidenceRows": 0,
    "citationGradeRows": 0,
    "answerableWithoutTextEvidenceRows": 0,
    "runtimeVisibleRows": 0,
    "indexEligibleRows": 0,
    "privatePathLeakRows": 0,
    "schemaViolationCount": 0,
    "blockedRows": 0
  },
  "recommendationRowsDetail": [
    {
      "schema": "knowledge-hub.paper.visual-retrieval-hint-candidate-store-expansion-gpt-recommendation-validation-row.v1",
      "sourceDecisionRowId": "visual-retrieval-hint-expansion-decision:6eb061dfeece81c4626f",
      "sourcePackDecisionRowId": "visual-retrieval-hint-expansion-decision:6eb061dfeece81c4626f",
      "hintCandidateId": "visual-retrieval-hint:clip-2021:image_region:2:e25902a7066b85fb",
      "sourceCandidateId": "visual-layout:clip-2021:image_region:2:2616032b2a9d352d",
      "paperId": "clip-2021",
      "paperRef": "papers_dir/Learning Transferable Visual Models From Natural Language Supervision.pdf",
      "sourceContentHash": "sha256:6478b6e571a7d6fcd846d8ef77bfd60c285f1986abb8f475eedc43de403074f5",
      "page": 2,
      "bbox": [
        338.6,
        184.18,
        365.52,
        211.1
      ],
      "candidateType": "image_region",
      "suggestedDecision": "approve_store_candidate_only",
      "recommendationRationale": "Coherent CLIP Figure 1 retrieval hint with visible labels, prompt template, encoders, and zero-shot prediction context; clearly framed as non-evidence.",
      "risk": "low: crop is partial but enough visible text supports useful retrieval-only indexing.",
      "needsHumanCheck": true,
      "policy": {
        "allowedUse": "recommendation_only",
        "finalHumanDecision": false,
        "applyAllowed": false,
        "candidateStoreWrite": false,
        "strictEvidence": false,
        "citationGrade": false,
        "answerableWithoutTextEvidence": false,
        "runtimeVisible": false,
        "indexEligible": false
      },
      "validation": {
        "matchedPackRow": true,
        "matchedDecisionRowId": true,
        "matchedSourceCandidateId": true,
        "policyCompliant": true,
        "violationReasons": []
      }
    },
    {
      "schema": "knowledge-hub.paper.visual-retrieval-hint-candidate-store-expansion-gpt-recommendation-validation-row.v1",
      "sourceDecisionRowId": "visual-retrieval-hint-expansion-decision:df43a4bfbe69d6bcb4a1",
      "sourcePackDecisionRowId": "visual-retrieval-hint-expansion-decision:df43a4bfbe69d6bcb4a1",
      "hintCandidateId": "visual-retrieval-hint:mae-2021:image_region:1:d54434235dc1f73e",
      "sourceCandidateId": "visual-layout:mae-2021:image_region:1:258a60cc216d8130",
      "paperId": "mae-2021",
      "paperRef": "papers_dir/Masked Autoencoders Are Scalable Vision Learners.pdf",
      "sourceContentHash": "sha256:1b490443925c72a2b7c770f90dd797e248729ae34a57e1abfe9ed36751c4cc5b",
      "page": 1,
      "bbox": [
        368.22,
        231.94,
        378.9,
        242.63
      ],
      "candidateType": "image_region",
      "suggestedDecision": "hold_pending_more_context",
      "recommendationRationale": "Potentially useful MAE architecture hint, but author/title fragments and partial caption suggest the crop may mix metadata with figure content.",
      "risk": "medium: useful visual context, but incomplete crop could reduce precision or confuse figure boundaries.",
      "needsHumanCheck": true,
      "policy": {
        "allowedUse": "recommendation_only",
        "finalHumanDecision": false,
        "applyAllowed": false,
        "candidateStoreWrite": false,
        "strictEvidence": false,
        "citationGrade": false,
        "answerableWithoutTextEvidence": false,
        "runtimeVisible": false,
        "indexEligible": false
      },
      "validation": {
        "matchedPackRow": true,
        "matchedDecisionRowId": true,
        "matchedSourceCandidateId": true,
        "policyCompliant": true,
        "violationReasons": []
      }
    },
    {
      "schema": "knowledge-hub.paper.visual-retrieval-hint-candidate-store-expansion-gpt-recommendation-validation-row.v1",
      "sourceDecisionRowId": "visual-retrieval-hint-expansion-decision:b559f2041324d26c0de5",
      "sourcePackDecisionRowId": "visual-retrieval-hint-expansion-decision:b559f2041324d26c0de5",
      "hintCandidateId": "visual-retrieval-hint:alexnet-2012:image_region:6:6bc72fab3308cc56",
      "sourceCandidateId": "visual-layout:alexnet-2012:image_region:6:508eb98021de0fd7",
      "paperId": "alexnet-2012",
      "paperRef": "papers_dir/4824-imagenet-classification-with-deep-convolutional-neural-networks.pdf",
      "sourceContentHash": "sha256:90137160c57217953d5f61857e64ca58e85f06e1b13b4f475c918b1b582b9771",
      "page": 6,
      "bbox": [
        348.09,
        426.97,
        504.01,
        487.66
      ],
      "candidateType": "image_region",
      "suggestedDecision": "approve_store_candidate_only",
      "recommendationRationale": "Clear AlexNet Figure 3 hint describing first-layer convolutional kernels, kernel size, input size, and GPU split; useful for retrieval only.",
      "risk": "low: surrounding body text is partial, but the figure/caption identification is coherent.",
      "needsHumanCheck": true,
      "policy": {
        "allowedUse": "recommendation_only",
        "finalHumanDecision": false,
        "applyAllowed": false,
        "candidateStoreWrite": false,
        "strictEvidence": false,
        "citationGrade": false,
        "answerableWithoutTextEvidence": false,
        "runtimeVisible": false,
        "indexEligible": false
      },
      "validation": {
        "matchedPackRow": true,
        "matchedDecisionRowId": true,
        "matchedSourceCandidateId": true,
        "policyCompliant": true,
        "violationReasons": []
      }
    },
    {
      "schema": "knowledge-hub.paper.visual-retrieval-hint-candidate-store-expansion-gpt-recommendation-validation-row.v1",
      "sourceDecisionRowId": "visual-retrieval-hint-expansion-decision:5b4b81e34fa9b65bc885",
      "sourcePackDecisionRowId": "visual-retrieval-hint-expansion-decision:5b4b81e34fa9b65bc885",
      "hintCandidateId": "visual-retrieval-hint:clip-2021:image_region:2:0d674a922cfdab51",
      "sourceCandidateId": "visual-layout:clip-2021:image_region:2:2642c8db8bd29d0a",
      "paperId": "clip-2021",
      "paperRef": "papers_dir/Learning Transferable Visual Models From Natural Language Supervision.pdf",
      "sourceContentHash": "sha256:6478b6e571a7d6fcd846d8ef77bfd60c285f1986abb8f475eedc43de403074f5",
      "page": 2,
      "bbox": [
        68.23,
        178.57,
        95.15,
        205.5
      ],
      "candidateType": "image_region",
      "suggestedDecision": "approve_store_candidate_only",
      "recommendationRationale": "Coherent CLIP contrastive pre-training panel with visible prompt/image examples and encoder labels; useful as a non-evidence retrieval hint.",
      "risk": "low: encoder labels are partially cropped, but the panel content remains identifiable.",
      "needsHumanCheck": true,
      "policy": {
        "allowedUse": "recommendation_only",
        "finalHumanDecision": false,
        "applyAllowed": false,
        "candidateStoreWrite": false,
        "strictEvidence": false,